Descrição do Contrato,Categoria,Data de Vencimento,Fornecedor,Valor do Contrato,Moeda
Contrato de Fornecimento de Materiais de Escritório,Fornecimento,15/12/2024,OfficeMax,1250.50,BRL
Contrato de Locação de Imóvel Comercial,Locação,30/06/2025,RealEstateCorp,2800.00,USD
Contrato de Consultoria em Marketing Digital,Consultoria,22/03/2025,DigitalMinds,1800.75,EUR
Licença de Software de Gestão de Projetos,Software,10/09/2025,TechSolutions,750.00,USD
Apólice de Seguro de Responsabilidade Civil,Seguro,05/05/2025,SafeGuard,450.00,BRL
Contrato de Manutenção Preventiva de Equipamentos,Manutenção,18/01/2025,EquipTech,920.00,EUR
Contrato de Fornecimento de Insumos Industriais,Fornecimento,27/11/2024,GlobalSupplies,2500.00,BRL
Contrato de Locação de Veículos para Frota,Locação,12/07/2025,RentACar,1500.00,USD
Consultoria em Recursos Humanos,Consultoria,01/04/2025,HRConsult,900.00,EUR
